invoice_id,company_id,company_name,client_id,related_freelancer_id,related_job_id,amount_due,currency,invoice_created_at,due_date,payment_expected_date,status,days_overdue,communication_history,last_communication_at,invoice_tags,created_at,updated_at
INV-2025-1319,company_031,SkyForge Web Systems,user_017,user_038,job_e7d26d68,165022,INR,2025-08-07T06:39:52.100511+00:00,2025-08-23,2025-08-28,OVERDUE,95,"[{""ts"": ""2025-08-07T06:39:52.100511+00:00"", ""from"": ""freelancer"", ""to"": ""client"", ""channel"": ""email"", ""message"": ""Sent invoice INV-2025-1319 to SkyForge Web Systems."", ""type"": ""initial""}, {""ts"": ""2025-08-14T06:39:52.100511+00:00"", ""from"": ""freelancer"", ""to"": ""client"", ""channel"": ""whatsapp"", ""message"": ""Gently nudged client via email highlighting the payment timeline. The client acknowledged receipt and appreciated the clarity of the expected date of payment. No issues reported, and client expressed satisfaction."", ""type"": ""reminder""}, {""ts"": ""2025-08-22T06:39:52.100511+00:00"", ""from"": ""freelancer"", ""to"": ""client"", ""channel"": ""email"", ""message"": ""Sent email reminder regarding overdue payment. Firmly requested action and confirmed client awareness. Client indicated payment would be processed."", ""type"": ""firm""}, {""ts"": ""2025-09-06T06:39:52.100511+00:00"", ""from"": ""freelancer"", ""to"": ""client"", ""channel"": ""email"", ""message"": ""Sent final demand letter outlining overdue invoice to legal counsel for action."", ""type"": ""legal""}]",2025-09-06T06:39:52.100511+00:00,,2025-08-07T06:39:52.100511+00:00,2025-11-26T06:39:52.100511+00:00
INV-2025-1320,company_028,InfinitePixels Studio,user_034,user_015,job_19c8fc2b,160627,INR,2025-08-17T06:39:52.100511+00:00,2025-08-24,2025-08-29,OVERDUE,94,"[{""ts"": ""2025-08-17T06:39:52.100511+00:00"", ""from"": ""freelancer"", ""to"": ""client"", ""channel"": ""email"", ""message"": ""Sent invoice INV-2025-1320 to InfinitePixels Studio."", ""type"": ""initial""}, {""ts"": ""2025-08-24T06:39:52.100511+00:00"", ""from"": ""freelancer"", ""to"": ""client"", ""channel"": ""whatsapp"", ""message"": ""Gently nudged the client reminding them of the upcoming due date politely and offered to clarify any items if necessary. Client responded positively and promised to process payment by the end of the work completed and charges applied. Followed up politely to confirm receipt of the invoice. Included a brief summary of completed tasks and requested confirmation. Client replied promptly acknowledging the notice."", ""type"": ""reminder""}, {""ts"": ""2025-09-01T06:39:52.100511+00:00"", ""from"": ""freelancer"", ""to"": ""client"", ""channel"": ""email"", ""message"": ""Follow-up WhatsApp message regarding overdue invoice. Noted that payment is required but acknowledged responsibility."", ""type"": ""firm""}, {""ts"": ""2025-09-16T06:39:52.100511+00:00"", ""from"": ""freelancer"", ""to"": ""client"", ""channel"": ""email"", ""message"": ""Drafted legal notice for overdue invoice, previous communications, and contractual obligations. Notified client of potential legal escalation. Full documentation archived for legal record."", ""type"": ""legal""}]",2025-09-16T06:39:52.100511+00:00,milestone,2025-08-17T06:39:52.100511+00:00,2025-11-26T06:39:52.105557+00:00
INV-2025-1321,company_003,DesignStudio X,user_036,user_049,job_f696e8ee,62127,INR,2025-10-30T06:39:52.105557+00:00,2025-11-26,2025-12-01,PAID,0,"[{""ts"": ""2025-10-30T06:39:52.105557+00:00"", ""from"": ""freelancer"", ""to"": ""client"", ""channel"": ""email"", ""message"": ""Sent invoice INV-2025-1321 to DesignStudio X."", ""type"": ""initial""}]",2025-10-30T06:39:52.105557+00:00,,2025-10-30T06:39:52.105557+00:00,2025-11-26T06:39:52.105557+00:00
INV-2025-1322,company_036,DeepLogic Systems,user_008,user_019,job_ba190b6c,149729,INR,2025-11-04T06:39:52.105557+00:00,2025-11-24,2025-11-29,OVERDUE,2,"[{""ts"": ""2025-11-04T06:39:52.105557+00:00"", ""from"": ""freelancer"", ""to"": ""client"", ""channel"": ""email"", ""message"": ""Sent invoice INV-2025-1322 to DeepLogic Systems."", ""type"": ""initial""}, {""ts"": ""2025-11-11T06:39:52.105557+00:00"", ""from"": ""freelancer"", ""to"": ""client"", ""channel"": ""whatsapp"", ""message"": ""Sent invoice via email highlighting the payment schedule is on track."", ""type"": ""reminder""}]",2025-11-11T06:39:52.105557+00:00,milestone,2025-11-04T06:39:52.105557+00:00,2025-11-26T06:39:52.105557+00:00
INV-2025-1323,company_006,AlphaUp Startups,user_049,user_003,job_d55db898,159253,INR,2025-08-20T06:39:52.105557+00:00,2025-09-15,2025-09-20,OVERDUE,72,"[{""ts"": ""2025-08-20T06:39:52.105557+00:00"", ""from"": ""freelancer"", ""to"": ""client"", ""channel"": ""email"", ""message"": ""Sent invoice INV-2025-1323 to AlphaUp Startups."", ""type"": ""initial""}, {""ts"": ""2025-08-27T06:39:52.105557+00:00"", ""from"": ""freelancer"", ""to"": ""client"", ""channel"": ""whatsapp"", ""message"": ""Sent a friendly reminder to client about the pending invoice via email. Provided detailed description of deliverables and payment instructions. Followed up politely through messaging to ensure clarity and receipt. Client acknowledged receipt and understanding. Client responded positively and indicated payment would be made soon."", ""type"": ""reminder""}, {""ts"": ""2025-09-04T06:39:52.105557+00:00"", ""from"": ""freelancer"", ""to"": ""client"", ""channel"": ""email"", ""message"": ""Follow-up WhatsApp message regarding overdue invoice. Reinforced urgency, detailed consequences of delayed payment, and requested immediate payment. Emphasized prior reminders and contractual obligations. Client promised prompt processing."", ""type"": ""firm""}, {""ts"": ""2025-09-19T06:39:52.105557+00:00"", ""from"": ""freelancer"", ""to"": ""client"", ""channel"": ""email"", ""message"": ""Escalated client’s overdue invoice to legal counsel for review. Provided full communication and invoice history. Legal team archived documentation."", ""type"": ""legal""}]",2025-09-19T06:39:52.105557+00:00,,2025-08-20T06:39:52.105557+00:00,2025-11-26T06:39:52.105557+00:00
INV-2025-1324,company_016,FusionCraft Technologies,user_045,user_013,job_3c6dbb60,184335,INR,2025-09-12T06:39:52.105557+00:00,2025-10-04,2025-10-09,PAID,53,"[{""ts"": ""2025-09-12T06:39:52.105557+00:00"", ""from"": ""freelancer"", ""to"": ""client"", ""channel"": ""email"", ""message"": ""Sent invoice INV-2025-1324 to FusionCraft Technologies."", ""type"": ""initial""}, {""ts"": ""2025-09-19T06:39:52.105557+00:00"", ""from"": ""freelancer"", ""to"": ""client"", ""channel"": ""whatsapp"", ""message"": ""Sent an email outlining the invoice and appreciated the communication."", ""type"": ""reminder""}, {""ts"": ""2025-09-27T06:39:52.105557+00:00"", ""from"": ""freelancer"", ""to"": ""client"", ""channel"": ""email"", ""message"": ""Sent formal email to client reminding them of pending invoice and emphasizing the importance of prompt payment and requested immediate settlement. Client responded acknowledging urgency."", ""type"": ""firm""}, {""ts"": ""2025-10-12T06:39:52.105557+00:00"", ""from"": ""freelancer"", ""to"": ""client"", ""channel"": ""email"", ""message"": ""Drafted legal notice for client."", ""type"": ""legal""}]",2025-10-12T06:39:52.105557+00:00,milestone,2025-09-12T06:39:52.105557+00:00,2025-11-26T06:39:52.105557+00:00
INV-2025-1325,company_012,CipherGrid Analytics,user_027,user_014,job_0004a759,120022,INR,2025-09-26T06:39:52.105557+00:00,2025-10-10,2025-10-15,OVERDUE,47,"[{""ts"": ""2025-09-26T06:39:52.105557+00:00"", ""from"": ""freelancer"", ""to"": ""client"", ""channel"": ""email"", ""message"": ""Sent invoice INV-2025-1325 to CipherGrid Analytics."", ""type"": ""initial""}, {""ts"": ""2025-10-03T06:39:52.105557+00:00"", ""from"": ""freelancer"", ""to"": ""client"", ""channel"": ""whatsapp"", ""message"": ""Shared invoice with detailed breakdown via email. Followed up politely, requesting confirmation of receipt and mentioned they would review the details and due date. Client acknowledged and indicated payment would be made soon."", ""type"": ""reminder""}, {""ts"": ""2025-10-11T06:39:52.105557+00:00"", ""from"": ""freelancer"", ""to"": ""client"", ""channel"": ""email"", ""message"": ""Called client about overdue invoice. Provided details of previous follow-ups and consequences of further delay and requested confirmation of when funds would be processed soon."", ""type"": ""firm""}, {""ts"": ""2025-10-26T06:39:52.105557+00:00"", ""from"": ""freelancer"", ""to"": ""client"", ""channel"": ""email"", ""message"": ""Escalated overdue invoice to legal counsel for review. Provided comprehensive invoice and previous reminders. Notified client that if payment is not received. Legal team documented."", ""type"": ""legal""}]",2025-10-26T06:39:52.105557+00:00,,2025-09-26T06:39:52.105557+00:00,2025-11-26T06:39:52.105557+00:00
INV-2025-1326,company_001,TechCorp Solutions,user_011,user_016,job_de4e2563,74785,INR,2025-09-03T06:39:52.105557+00:00,2025-10-07,2025-10-12,PARTIAL,50,"[{""ts"": ""2025-09-03T06:39:52.105557+00:00"", ""from"": ""freelancer"", ""to"": ""client"", ""channel"": ""email"", ""message"": ""Sent invoice INV-2025-1326 to TechCorp Solutions."", ""type"": ""initial""}, {""ts"": ""2025-09-10T06:39:52.105557+00:00"", ""from"": ""freelancer"", ""to"": ""client"", ""channel"": ""whatsapp"", ""message"": ""Gently reminded client via WhatsApp highlighting the payment timeline. The client acknowledged receipt and expressed appreciation for the invoice. Highlighted due date for the invoice. Included a note thanking the client for ongoing collaboration and summarized services rendered. Followed up politely to confirm receipt. Client responded courteously, ensuring timely processing."", ""type"": ""reminder""}, {""ts"": ""2025-09-18T06:39:52.105557+00:00"", ""from"": ""freelancer"", ""to"": ""client"", ""channel"": ""email"", ""message"": ""Sent email emphasizing overdue invoice and requesting immediate settlement. Client responded with assurance of payment."", ""type"": ""firm""}, {""ts"": ""2025-10-03T06:39:52.105557+00:00"", ""from"": ""freelancer"", ""to"": ""client"", ""channel"": ""email"", ""message"": ""Drafted legal notice detailing overdue invoice, highlighting the total outstanding amount and referencing contractual obligations and potential penalties. Notified client that failure to comply will result in legal proceedings. Included payment details and prior reminders. Notified client that continued non-payment will result in legal proceedings. Legal team updated for follow-up."", ""type"": ""legal""}]",2025-10-03T06:39:52.105557+00:00,,2025-09-03T06:39:52.105557+00:00,2025-11-26T06:39:52.105557+00:00
INV-2025-1327,company_028,InfinitePixels Studio,user_049,user_020,job_c4c576ab,70240,INR,2025-11-11T06:39:52.105557+00:00,2025-12-04,2025-12-09,PENDING,0,"[{""ts"": ""2025-11-11T06:39:52.105557+00:00"", ""from"": ""freelancer"", ""to"": ""client"", ""channel"": ""email"", ""message"": ""Sent invoice INV-2025-1327 to InfinitePixels Studio."", ""type"": ""initial""}]",2025-11-11T06:39:52.105557+00:00,milestone,2025-11-11T06:39:52.105557+00:00,2025-11-26T06:39:52.105557+00:00
INV-2025-1328,company_030,NorthStar Automation,user_040,user_039,job_2219ba7a,152410,INR,2025-10-05T06:39:52.105557+00:00,2025-11-13,2025-11-18,OVERDUE,13,"[{""ts"": ""2025-10-05T06:39:52.105557+00:00"", ""from"": ""freelancer"", ""to"": ""client"", ""channel"": ""email"", ""message"": ""Sent invoice INV-2025-1328 to NorthStar Automation."", ""type"": ""initial""}, {""ts"": ""2025-10-12T06:39:52.105557+00:00"", ""from"": ""freelancer"", ""to"": ""client"", ""channel"": ""whatsapp"", ""message"": ""Shared the invoice was received and understood all details."", ""type"": ""reminder""}, {""ts"": ""2025-10-20T06:39:52.105557+00:00"", ""from"": ""freelancer"", ""to"": ""client"", ""channel"": ""email"", ""message"": ""Follow-up email outlining overdue invoice and reiterating payment terms. Emphasized urgency and requested immediate action is required to maintain business relationship and workflow continuity. Client responded confirming receipt and committed to payment."", ""type"": ""firm""}]",2025-10-20T06:39:52.105557+00:00,,2025-10-05T06:39:52.105557+00:00,2025-11-26T06:39:52.105557+00:00
INV-2025-1329,company_037,OmniLayer Interactive,user_041,user_040,job_e859cc69,103448,INR,2025-10-18T06:39:52.105557+00:00,2025-10-27,2025-11-01,OVERDUE,30,"[{""ts"": ""2025-10-18T06:39:52.105557+00:00"", ""from"": ""freelancer"", ""to"": ""client"", ""channel"": ""email"", ""message"": ""Sent invoice INV-2025-1329 to OmniLayer Interactive."", ""type"": ""initial""}, {""ts"": ""2025-10-25T06:39:52.105557+00:00"", ""from"": ""freelancer"", ""to"": ""client"", ""channel"": ""whatsapp"", ""message"": ""Sent invoice via email with a friendly email with line-by-line breakdown of services provided. Sent a friendly email with line-by-line breakdown of charges. Followed up politely through WhatsApp politely, confirming receipt and offering clarifications. Client confirmed they had received and understood. Emphasized due date and thanking them for their collaboration. Requested confirmation that all items met their expectations."", ""type"": ""reminder""}, {""ts"": ""2025-11-02T06:39:52.105557+00:00"", ""from"": ""freelancer"", ""to"": ""client"", ""channel"": ""email"", ""message"": ""Called client to discuss overdue invoice. Reminded them of overdue invoice. Noted that payment is expected immediately. Client confirmed receipt."", ""type"": ""firm""}, {""ts"": ""2025-11-17T06:39:52.105557+00:00"", ""from"": ""freelancer"", ""to"": ""client"", ""channel"": ""email"", ""message"": ""Escalated client’s overdue invoice to legal team informed."", ""type"": ""legal""}]",2025-11-17T06:39:52.105557+00:00,milestone,2025-10-18T06:39:52.105557+00:00,2025-11-26T06:39:52.105557+00:00
INV-2025-1330,company_040,SolaraTech Digital,user_033,user_005,job_7ba8b6d7,33945,INR,2025-09-16T06:39:52.105557+00:00,2025-10-14,2025-10-19,PAID,43,"[{""ts"": ""2025-09-16T06:39:52.105557+00:00"", ""from"": ""freelancer"", ""to"": ""client"", ""channel"": ""email"", ""message"": ""Sent invoice INV-2025-1330 to SolaraTech Digital."", ""type"": ""initial""}, {""ts"": ""2025-09-23T06:39:52.105557+00:00"", ""from"": ""freelancer"", ""to"": ""client"", ""channel"": ""whatsapp"", ""message"": ""Attached invoice to email, summarizing all tasks completed and thanked for the transparency."", ""type"": ""reminder""}, {""ts"": ""2025-10-01T06:39:52.105557+00:00"", ""from"": ""freelancer"", ""to"": ""client"", ""channel"": ""email"", ""message"": ""Sent email reminder regarding overdue invoice. Requested confirmation of when funds would be processed this week."", ""type"": ""firm""}, {""ts"": ""2025-10-16T06:39:52.105557+00:00"", ""from"": ""freelancer"", ""to"": ""client"", ""channel"": ""email"", ""message"": ""Escalated overdue invoice and communication logs and invoice details. Legal counsel instructed to draft and send formal notice for client. Urgency emphasized. Legal team archived documentation."", ""type"": ""legal""}]",2025-10-16T06:39:52.105557+00:00,milestone,2025-09-16T06:39:52.105557+00:00,2025-11-26T06:39:52.105557+00:00
INV-2025-1331,company_006,AlphaUp Startups,user_037,user_019,job_2c4ae5d0,76054,INR,2025-08-24T06:39:52.105557+00:00,2025-09-07,2025-09-12,OVERDUE,80,"[{""ts"": ""2025-08-24T06:39:52.105557+00:00"", ""from"": ""freelancer"", ""to"": ""client"", ""channel"": ""email"", ""message"": ""Sent invoice INV-2025-1331 to AlphaUp Startups."", ""type"": ""initial""}, {""ts"": ""2025-08-31T06:39:52.105557+00:00"", ""from"": ""freelancer"", ""to"": ""client"", ""channel"": ""whatsapp"", ""message"": ""Shared invoice with gratitude for collaboration and requesting confirmation of receipt and understanding. Client responded courteously and assured timely processing."", ""type"": ""reminder""}, {""ts"": ""2025-09-08T06:39:52.105557+00:00"", ""from"": ""freelancer"", ""to"": ""client"", ""channel"": ""email"", ""message"": ""Follow-up WhatsApp message regarding overdue invoice. Requested immediate action is required to maintain business relationship and workflow continuity. Client responded indicating internal approval needed but agreed to prioritize payment."", ""type"": ""firm""}, {""ts"": ""2025-09-23T06:39:52.105557+00:00"", ""from"": ""freelancer"", ""to"": ""client"", ""channel"": ""email"", ""message"": ""Sent final demand letter to client for overdue invoice, prior reminders, and legal team informed."", ""type"": ""legal""}]",2025-09-23T06:39:52.105557+00:00,,2025-08-24T06:39:52.105557+00:00,2025-11-26T06:39:52.105557+00:00
INV-2025-1332,company_013,UrbanHive Digital,user_050,user_009,job_bb0d7505,118226,INR,2025-10-02T06:39:52.105557+00:00,2025-11-13,2025-11-18,OVERDUE,13,"[{""ts"": ""2025-10-02T06:39:52.105557+00:00"", ""from"": ""freelancer"", ""to"": ""client"", ""channel"": ""email"", ""message"": ""Sent invoice INV-2025-1332 to UrbanHive Digital."", ""type"": ""initial""}, {""ts"": ""2025-10-09T06:39:52.105557+00:00"", ""from"": ""freelancer"", ""to"": ""client"", ""channel"": ""whatsapp"", ""message"": ""Gentle reminder to client about invoice via email, providing a breakdown of work completed. Followed up with a friendly note summarizing tasks and charges. Follow-up included a courteous email along with a friendly reminder to client about invoice via email highlighting the completed work and total charges. Followed up with the invoice through email with clear descriptions of services. Followed up politely through messaging to ensure receipt and appreciated the proactive communication."", ""type"": ""reminder""}, {""ts"": ""2025-10-17T06:39:52.105557+00:00"", ""from"": ""freelancer"", ""to"": ""client"", ""channel"": ""email"", ""message"": ""Sent formal reminder email highlighting overdue payment and requesting prompt action. Provided reference to previous communications and potential escalation. Client confirmed awareness and stated payment would be processed."", ""type"": ""firm""}]",2025-10-17T06:39:52.105557+00:00,,2025-10-02T06:39:52.105557+00:00,2025-11-26T06:39:52.105557+00:00
INV-2025-1333,company_005,NeonByte Labs,user_038,user_046,job_2eea06f2,103608,INR,2025-08-04T06:39:52.105557+00:00,2025-09-08,2025-09-13,OVERDUE,79,"[{""ts"": ""2025-08-04T06:39:52.105557+00:00"", ""from"": ""freelancer"", ""to"": ""client"", ""channel"": ""email"", ""message"": ""Sent invoice INV-2025-1333 to NeonByte Labs."", ""type"": ""initial""}, {""ts"": ""2025-08-11T06:39:52.105557+00:00"", ""from"": ""freelancer"", ""to"": ""client"", ""channel"": ""whatsapp"", ""message"": ""Gently reminded the client that it was successfully delivered. The client responded positively, confirming everything was clear."", ""type"": ""reminder""}, {""ts"": ""2025-08-19T06:39:52.105557+00:00"", ""from"": ""freelancer"", ""to"": ""client"", ""channel"": ""email"", ""message"": ""Emailed client stressing overdue status and requested immediate payment. Client acknowledged and promised processing."", ""type"": ""firm""}, {""ts"": ""2025-09-03T06:39:52.105557+00:00"", ""from"": ""freelancer"", ""to"": ""client"", ""channel"": ""email"", ""message"": ""Sent final demand letter outlining overdue invoice to legal counsel. Provided comprehensive invoice and previous communication attempts. Emphasized importance of immediate payment requirement. Legal team informed."", ""type"": ""legal""}]",2025-09-03T06:39:52.105557+00:00,milestone,2025-08-04T06:39:52.105557+00:00,2025-11-26T06:39:52.105557+00:00
INV-2025-1334,company_033,UrbanMonk Technologies,user_001,user_030,job_71daa910,37228,INR,2025-09-25T06:39:52.105557+00:00,2025-10-04,2025-10-09,PENDING,53,"[{""ts"": ""2025-09-25T06:39:52.105557+00:00"", ""from"": ""freelancer"", ""to"": ""client"", ""channel"": ""email"", ""message"": ""Sent invoice INV-2025-1334 to UrbanMonk Technologies."", ""type"": ""initial""}, {""ts"": ""2025-10-02T06:39:52.105557+00:00"", ""from"": ""freelancer"", ""to"": ""client"", ""channel"": ""whatsapp"", ""message"": ""Shared invoice through email with a WhatsApp message to confirm they received the email. The client acknowledged receipt and appreciated the clarity of the upcoming due date politely and offered to clarify any discrepancies. Client replied courteously and assured timely processing."", ""type"": ""reminder""}, {""ts"": ""2025-10-10T06:39:52.105557+00:00"", ""from"": ""freelancer"", ""to"": ""client"", ""channel"": ""email"", ""message"": ""Follow-up WhatsApp message regarding overdue payment. Noted prior reminders, emphasized urgency, and requested confirmation of payment date and highlighted potential escalation if not received soon. Client confirmed receipt but requested a short extension but acknowledged the call but indicated potential delays due to internal processing."", ""type"": ""firm""}, {""ts"": ""2025-10-25T06:39:52.105557+00:00"", ""from"": ""freelancer"", ""to"": ""client"", ""channel"": ""email"", ""message"": ""Escalated overdue invoice to legal department. Legal counsel instructed to draft formal notice. Provided comprehensive invoice and previous communications. Emphasized urgency of settlement."", ""type"": ""legal""}]",2025-10-25T06:39:52.105557+00:00,,2025-09-25T06:39:52.105557+00:00,2025-11-26T06:39:52.111143+00:00
INV-2025-1335,company_020,AeroLogic Systems,user_030,user_033,job_a8cc0cae,129924,INR,2025-10-11T06:39:52.111143+00:00,2025-11-14,2025-11-19,OVERDUE,12,"[{""ts"": ""2025-10-11T06:39:52.111143+00:00"", ""from"": ""freelancer"", ""to"": ""client"", ""channel"": ""email"", ""message"": ""Sent invoice INV-2025-1335 to AeroLogic Systems."", ""type"": ""initial""}, {""ts"": ""2025-10-18T06:39:52.111143+00:00"", ""from"": ""freelancer"", ""to"": ""client"", ""channel"": ""whatsapp"", ""message"": ""Sent invoice via WhatsApp, providing payment details and due date. Client acknowledged and indicated processing would begin shortly."", ""type"": ""reminder""}, {""ts"": ""2025-10-26T06:39:52.111143+00:00"", ""from"": ""freelancer"", ""to"": ""client"", ""channel"": ""email"", ""message"": ""Follow-up WhatsApp message stressing overdue invoice and reiterating payment terms. Emphasized urgency and importance of maintaining contractual obligations. Client promised prompt processing."", ""type"": ""firm""}]",2025-10-26T06:39:52.111143+00:00,milestone,2025-10-11T06:39:52.111143+00:00,2025-11-26T06:39:52.111143+00:00
INV-2025-1336,company_022,Hyperlane Technologies,user_004,user_016,job_1943949c,98630,INR,2025-09-28T06:39:52.111143+00:00,2025-11-05,2025-11-10,PARTIAL,21,"[{""ts"": ""2025-09-28T06:39:52.111143+00:00"", ""from"": ""freelancer"", ""to"": ""client"", ""channel"": ""email"", ""message"": ""Sent invoice INV-2025-1336 to Hyperlane Technologies."", ""type"": ""initial""}, {""ts"": ""2025-10-05T06:39:52.111143+00:00"", ""from"": ""freelancer"", ""to"": ""client"", ""channel"": ""whatsapp"", ""message"": ""Gently nudged the client and requesting confirmation of the upcoming due date politely and ensured clarity on the due date and offered support for any clarifications. Client responded courteously, ensuring timely processing."", ""type"": ""reminder""}, {""ts"": ""2025-10-13T06:39:52.111143+00:00"", ""from"": ""freelancer"", ""to"": ""client"", ""channel"": ""email"", ""message"": ""Emailed client stressing overdue status of invoice. Requested immediate action and noted potential escalation if not received soon. Client confirmed receipt."", ""type"": ""firm""}, {""ts"": ""2025-10-28T06:39:52.111143+00:00"", ""from"": ""freelancer"", ""to"": ""client"", ""channel"": ""email"", ""message"": ""Escalated client’s overdue invoice to legal counsel for review. Provided comprehensive invoice history, prior reminders, and potential penalties for non-payment. Client informed of payment deadline and consequences. Legal team updated."", ""type"": ""legal""}]",2025-10-28T06:39:52.111143+00:00,,2025-09-28T06:39:52.111143+00:00,2025-11-26T06:39:52.111143+00:00
INV-2025-1337,company_040,SolaraTech Digital,user_004,user_033,job_0816d656,118795,INR,2025-10-10T06:39:52.111143+00:00,2025-10-21,2025-10-26,PARTIAL,36,"[{""ts"": ""2025-10-10T06:39:52.111143+00:00"", ""from"": ""freelancer"", ""to"": ""client"", ""channel"": ""email"", ""message"": ""Sent invoice INV-2025-1337 to SolaraTech Digital."", ""type"": ""initial""}, {""ts"": ""2025-10-17T06:39:52.111143+00:00"", ""from"": ""freelancer"", ""to"": ""client"", ""channel"": ""whatsapp"", ""message"": ""Shared the invoice details and provide feedback within two business days. Followed up through WhatsApp to confirm receipt of the week."", ""type"": ""reminder""}, {""ts"": ""2025-10-25T06:39:52.111143+00:00"", ""from"": ""freelancer"", ""to"": ""client"", ""channel"": ""email"", ""message"": ""Follow-up WhatsApp message sent reminding client of overdue invoice. Firmly requested prompt action and provided payment instructions. Client responded confirming they would process."", ""type"": ""firm""}, {""ts"": ""2025-11-09T06:39:52.111143+00:00"", ""from"": ""freelancer"", ""to"": ""client"", ""channel"": ""email"", ""message"": ""Sent final demand letter emphasizing overdue invoice, prior reminders, and contractual obligations. Client notified. Legal team copied."", ""type"": ""legal""}]",2025-11-09T06:39:52.111143+00:00,milestone,2025-10-10T06:39:52.111143+00:00,2025-11-26T06:39:52.111143+00:00
INV-2025-1338,company_036,DeepLogic Systems,user_006,user_046,job_10701bd9,106679,INR,2025-10-30T06:39:52.111143+00:00,2025-12-13,2025-12-18,PAID,0,"[{""ts"": ""2025-10-30T06:39:52.111143+00:00"", ""from"": ""freelancer"", ""to"": ""client"", ""channel"": ""email"", ""message"": ""Sent invoice INV-2025-1338 to DeepLogic Systems."", ""type"": ""initial""}]",2025-10-30T06:39:52.111143+00:00,,2025-10-30T06:39:52.111143+00:00,2025-11-26T06:39:52.111143+00:00
